- id: "-miD36N4AVc"
  title: "Luke 8:19-25 - Edwin Chow"
  date: "2023-03-18 00:00:00+00:00"
  duration: "1960"
- id: "0NIhUzfvpAw"
  title: 'Luke 16:1-13 - "Generosity: Gospel Partnership", Tim Grant'
  date: "2023-03-04 00:00:00+00:00"
  duration: "2472"
- id: "0utcuvk2kmc"
  title: "Psalm 90 - Edwin Chow"
  date: "2023-01-01 00:00:00+00:00"
  duration: "1407"
- id: "0yqVdqHzpCw"
  title: "Revelation 8 & 9 - Tim Grant"
  date: "2022-08-13 00:00:00+00:00"
  duration: "2688"
- id: "1UwHBj-m-sU"
  title: "Habakkuk 2:1-14 - Chris (CMS)"
  date: "2022-04-10 00:00:00+00:00"
  duration: "1660"
- id: "2VN0f4ql-KA"
  title: "Revelation 1:9-20 - Tim Grant (27/02/2022)"
  date: "2023-04-17 00:00:00+00:00"
  duration: "1778"
- id: "2taUB9zHs5A"
  title: "Revelation 22:6-21 - Tim Grant"
  date: "2022-12-03 00:00:00+00:00"
  duration: "2400"
- id: "4vWy_MMDX8A"
  title: "Luke 7:36-50 - Tim Grant"
  date: "2023-02-04 00:00:00+00:00"
  duration: "2142"
- id: "5o9a1CR4sDY"
  title: "Revelation 1:1-8 - Tim Grant  (19/2/2022)"
  date: "2023-04-17 00:00:00+00:00"
  duration: "2009"
- id: "7jX8HVFlo8Q"
  title: "Revelation 2:8-11 - Edwin Chow (12/03/2022)"
  date: "2023-04-17 00:00:00+00:00"
  duration: "2378"
- id: "9sa01Uie4PA"
  title: "Luke 8:1-18 - David Bickerdike"
  date: "2023-03-11 00:00:00+00:00"
  duration: "3493"
- id: "ArrUmvcjoxk"
  title: "Luke 5:27-39 - Tim Grant"
  date: "2022-09-17 00:00:00+00:00"
  duration: "2623"
- id: "As1XxWkbRo0"
  title: "Revelation 6 & 7 - Tim Grant"
  date: "2022-08-06 00:00:00+00:00"
  duration: "3020"
- id: "CVwZt6KqySg"
  title: "Romans 3:1-20 (24/06/23)"
  date: "2023-06-24 00:00:00+00:00"
  duration: "1825"
- id: "D5KDUaMXKYg"
  title: "Ezra 4:24-5:5, Andrew Judd (Ridley)"
  date: "2022-05-21 00:00:00+00:00"
  duration: "3018"
- id: "DToZnIjDg1I"
  title: '2 Corinthians 9 - "Generosity: Towards the Church", Tim Grant'
  date: "2023-02-25 00:00:00+00:00"
  duration: "2714"
- id: "ED4K7WTDMxM"
  title: "Revelation 7:9-12 - Wei-Han Kuan (CMS Australia)"
  date: "2023-05-20 00:00:00+00:00"
  duration: "2670"
- id: "F0F0bGY4HHg"
  title: "Luke 5:12-26, Tim Grant"
  date: "2022-06-19 00:00:00+00:00"
  duration: "1736"
- id: "FeghbB9mm14"
  title: "Luke 6:43-49 - Edwin Chow"
  date: "2022-10-22 00:00:00+00:00"
  duration: "2063"
- id: "G74CV8sOYUQ"
  title: "Revelation 21:1-8 - Daniel Kong"
  date: "2022-11-19 00:00:00+00:00"
  duration: "2432"
- id: "HUYvngL2RuA"
  title: "Luke 3:1-38 - Tim Grant"
  date: "2022-05-08 00:00:00+00:00"
  duration: "2497"
- id: "KOu_iewV20Y"
  title: "Luke 4:31-44, Tim Grant"
  date: "2022-06-04 00:00:00+00:00"
  duration: "2199"
- id: "L8bTFZgIeys"
  title: "Revelation 4 - Tim Grant"
  date: "2022-07-23 00:00:00+00:00"
  duration: "2627"
- id: "LUeP8STR1NY"
  title: "Revelation 3:7-13 - Tim Grant"
  date: "2022-04-23 00:00:00+00:00"
  duration: "2018"
- id: "LVV_kaTRswU"
  title: "Matthew 28:16-30 - Ben Pfahlert"
  date: "2023-04-29 00:00:00+00:00"
  duration: "2788"
- id: "MN0dCZd3H_k"
  title: "Romans Overview at GCC (17th May 2023)"
  date: "2023-05-17 00:00:00+00:00"
  duration: "5876"
- id: "MXVpCzUQtPc"
  title: "Luke 9:1-17 (05/08/23)"
  date: "2023-08-05 00:00:00+00:00"
  duration: "2431"
- id: "NTxZ2zncuUQ"
  title: "Joash and Queenie - Ministry Encouragement"
  date: "2022-06-26 00:00:00+00:00"
  duration: "447"
- id: "NfyPyBJGqYw"
  title: "Romans 1:1-7 (27/5/23)"
  date: "2023-05-27 00:00:00+00:00"
  duration: "2063"
- id: "NrPAqqnfcko"
  title: "Zechariah 1:18-2:13 (15/07/2023)"
  date: "2023-07-15 00:00:00+00:00"
  duration: "2447"
- id: "R1oVtrEE49g"
  title: "Zechariah 3-4 (22/06/23)"
  date: "2023-07-22 00:00:00+00:00"
  duration: "1954"
- id: "RWqGQE7v4AE"
  title: "Psalm 24 - Tim Grant"
  date: "2023-01-14 00:00:00+00:00"
  duration: "1906"
- id: "RuINfxJniqQ"
  title: "Revelation 2:12-17 - Tim Grant (19/03/2022)"
  date: "2023-04-17 00:00:00+00:00"
  duration: "2146"
- id: "SJf7CiuDzTs"
  title: "Luke 8:26-39 - Tim Grant"
  date: "2023-03-26 00:00:00+00:00"
  duration: "1832"
- id: "S_2mZkVuEUk"
  title: "Zechariah 5-6 (29/07/23)"
  date: "2023-07-29 00:00:00+00:00"
  duration: "2480"
- id: "T1jo0xRMWyQ"
  title: "Revelation 12 & 13 - Tim Grant"
  date: "2022-08-27 00:00:00+00:00"
  duration: "2656"
- id: "Tl5BOYafexo"
  title: "Isaiah 8-9:1-7 - Michael Lim"
  date: "2022-12-10 00:00:00+00:00"
  duration: "3110"
- id: "TmtkP2dKn8k"
  title: 'James 2 -  "God''s heart for the poor", Tim Grant'
  date: "2023-02-18 00:00:00+00:00"
  duration: "3284"
- id: "U8CsLipeqEY"
  title: "Romans 2 (17/06/23)"
  date: "2023-06-17 00:00:00+00:00"
  duration: "1935"
- id: "VrBDre_2M8E"
  title: "Revelation 15 & 16 - Tim Grant"
  date: "2022-10-29 00:00:00+00:00"
  duration: "2325"
- id: "Vs_hnXnmPFY"
  title: "Revelation 3:14-22 - Tim Grant"
  date: "2022-04-30 00:00:00+00:00"
  duration: "2056"
- id: "WhfJSPZXEGg"
  title: "Revelation 17 & 18 - Tim Grant"
  date: "2022-11-05 00:00:00+00:00"
  duration: "2419"
- id: "ZHYQtXMhW9U"
  title: "Luke 5:1-11 (08/07/2023)"
  date: "2022-06-11 00:00:00+00:00"
  duration: "2005"
- id: "_0taX432qKE"
  title: "Zechariah Overview - 1:1-17 (02/07/2023)"
  date: "2023-07-09 00:00:00+00:00"
  duration: "2716"
- id: "_cv_1NnsFEg"
  title: "Luke 6:37-42 - Tim Grant"
  date: "2022-10-16 00:00:00+00:00"
  duration: "2176"
- id: "c1xaKFp0BKw"
  title: "Esther 1 & 2, Edwin Chow"
  date: "2022-06-25 00:00:00+00:00"
  duration: "2833"
- id: "c9MnydyYass"
  title: "Esther 5-7 - Edwin Chow"
  date: "2022-07-09 00:00:00+00:00"
  duration: "2699"
- id: "dHWCobOt07M"
  title: "Esther 3 & 4 - Edwin Chow"
  date: "2022-07-02 00:00:00+00:00"
  duration: "2405"
- id: "foCM0PSXj5w"
  title: '1 Timothy 6:11-21 - "Money", Tim Grant'
  date: "2023-02-11 00:00:00+00:00"
  duration: "2482"
- id: "fuv30JbBCoY"
  title: "Numbers 3-4 - Michael Lim"
  date: "2023-04-23 00:00:00+00:00"
  duration: "3257"
- id: "gNxjMdfNgFQ"
  title: "Luke 6:12-26 - Tim Grant"
  date: "2022-10-01 00:00:00+00:00"
  duration: "2127"
- id: "gkeplQcK2k8"
  title: "Revelation 2:1-7 - Tim Grant (05/03/2022)"
  date: "2023-04-17 00:00:00+00:00"
  duration: "2187"
- id: "h6U9bmmly18"
  title: "Esther 8 & 9 - Edwin Chow"
  date: "2022-07-16 00:00:00+00:00"
  duration: "2466"
- id: "hjL3R3D4rdU"
  title: "Luke 2:21-38 - David Bickerdike"
  date: "2022-12-17 00:00:00+00:00"
  duration: "2776"
- id: "iyROZYX4yBY"
  title: "Luke 6:1-11 - Tim Grant"
  date: "2022-09-25 00:00:00+00:00"
  duration: "1976"
- id: "jZ8HxZoZNm4"
  title: "Revelation 5 - Tim Grant"
  date: "2022-07-31 00:00:00+00:00"
  duration: "2197"
- id: "kWfqxNeG1zc"
  title: "Luke 7:1-17 - Edwin Chow"
  date: "2023-01-21 00:00:00+00:00"
  duration: "2371"
- id: "knyq_OV84UY"
  title: "Luke 7:18-35 - Edwin Chow"
  date: "2023-01-28 00:00:00+00:00"
  duration: "2407"
- id: "lMLQIVnLXdo"
  title: "Romans 3:21-26 (01/07/2023)"
  date: "2023-07-01 00:00:00+00:00"
  duration: "2400"
- id: "mR0k8Bmx7S4"
  title: "Psalm 23 - Tim Grant"
  date: "2023-01-07 00:00:00+00:00"
  duration: "1855"
- id: "n2_Wgaay2xE"
  title: "Revelation 2:18-29 - Tim Grant (26/03/2022)"
  date: "2023-04-23 00:00:00+00:00"
  duration: "1443"
- id: "pChBQ6gOYAg"
  title: "Revelation 21:9-27 - 22:1-5 - Tim Grant"
  date: "2022-11-26 00:00:00+00:00"
  duration: "2239"
- id: "pQAQ2aNpzig"
  title: "Revelation 1:1-8 - Tim Grant (20/2/2022)"
  date: "2022-02-26 00:00:00+00:00"
  duration: "1476"
- id: "popCM6YcyWA"
  title: "Romans 1:18-32 (10/06/23)"
  date: "2023-06-10 00:00:00+00:00"
  duration: "2489"
- id: "ppItoiWci8g"
  title: "Revelation 3:1-6 - Tim Grant (02/04/2022)"
  date: "2023-04-17 00:00:00+00:00"
  duration: "2037"
- id: "puED_TwT7t4"
  title: "Revelation 13 - 14 - Tim Grant"
  date: "2022-09-11 00:00:00+00:00"
  duration: "2452"
- id: "qOxDm_5AvJw"
  title: "Luke 8:40-56 - Tim Grant"
  date: "2023-04-01 00:00:00+00:00"
  duration: "2306"
- id: "qh_v85UCjoQ"
  title: "Numbers 6:22-10:10 - Tim Grant"
  date: "2023-05-13 00:00:00+00:00"
  duration: "2677"
- id: "qobou2ayilI"
  title: "Numbers Overview"
  date: "2023-03-29 00:00:00+00:00"
  duration: "5038"
- id: "raIFt8qQYXo"
  title: "Luke 4:1-13, Tim Grant"
  date: "2022-05-14 00:00:00+00:00"
  duration: "1947"
- id: "sVdjJhF25xo"
  title: "Luke 4:14-30, Tim Grant"
  date: "2022-05-28 00:00:00+00:00"
  duration: "2361"
- id: "sZbhgrrgQKo"
  title: "Numbers 1-2 - Tim Grant"
  date: "2023-04-15 00:00:00+00:00"
  duration: "3247"
- id: "tmzVLAa49J4"
  title: "Numbers 5-6:1-21 - Tim Grant"
  date: "2023-05-06 00:00:00+00:00"
  duration: "3211"
- id: "uqKbV68Eruc"
  title: "Luke 9:18-27 (12/08/23)"
  date: "2023-08-12 00:00:00+00:00"
  duration: "2023"
- id: "vlACO1XVqnk"
  title: "John 20 - Tim Grant (Easter Sunday)"
  date: "2023-04-08 00:00:00+00:00"
  duration: "2023"
- id: "vtk2nGDirk0"
  title: "Revelation 10 & 11 - Tim Grant"
  date: "2022-08-20 00:00:00+00:00"
  duration: "2510"
- id: "wIqcbJToGZk"
  title: "Romans 1:8-17 (03/06/23)"
  date: "2023-06-03 00:00:00+00:00"
  duration: "2871"
- id: "wV9fLUvcryw"
  title: "Revelation 19 & 20 - Tim Grant"
  date: "2022-11-12 00:00:00+00:00"
  duration: "2970"
- id: "xSkCA6xU7ac"
  title: "Revelation 2:18-29 - Tim Grant (26/03/2022)"
  date: "2023-04-17 00:00:00+00:00"
  duration: "1450"
- id: "z_O3v6MiMQ8"
  title: "Revelation 3:1-6 (2/04/2022)"
  date: "2023-04-23 00:00:00+00:00"
  duration: "2056"
